{
  "classification": "PRODUCTION_TEMPLATE_UNASSIGNED",
  "executable": false,
  "executorReleaseIdentity": "UNASSIGNED",
  "expectedPredecessorLedgerIdentity": {
    "name": "synthetic_pre_046_approved_slice",
    "statements": [
      "NON_DEPLOYABLE_TEST_ONLY approved predecessor fixture"
    ],
    "version": "99000000000045"
  },
  "manifestFormat": "TAIRET_STATEMENT_AWARE_ATOMIC_MIGRATION_MANIFEST",
  "manifestSha256": "5f6202ce9d27fa036f3d66f1e4298744f5ffb0952817c8e29c618795fe00b1c1",
  "manifestVersion": 1,
  "migrations": [
    {
      "canonicalSha256": "6f1b39fc66b53856e19475b20539de1377f20e29fe6ad99a79472c97dba2fe0c",
      "canonicalSize": 163792,
      "filename": "046_access_core_recoverable_fulfillment.sql",
      "ledgerName": "access_core_recoverable_fulfillment",
      "logicalNumber": "046",
      "orderedStatementIdentities": [
        {
          "index": 0,
          "sha256": "38c07f4f60e3f08b552b9812102587a0ee3f7284537d315936213ec53f49f4ad",
          "size": 143
        },
        {
          "index": 1,
          "sha256": "9cccfeefdd2bb973c45c808b97e3b163e200c5416fea5a4552cadac50ecfedc7",
          "size": 7425
        },
        {
          "index": 2,
          "sha256": "5a26cb41b2014030d3512f224cd502dc90dbed95d34d963387b79f786f40042c",
          "size": 63
        },
        {
          "index": 3,
          "sha256": "6305fa594f3d6a78b19734f8d39c081c5f46e3c0382d4176bafcc438321f363a",
          "size": 127
        },
        {
          "index": 4,
          "sha256": "4e22ea7d30a54c5cc38e6650ad845f02b58ef52a2a98437fc18afdfcd6042cd3",
          "size": 180
        },
        {
          "index": 5,
          "sha256": "c71a70ce2a77d49a7e0e6a26967872faf61a74306736039e3c5142076d8e01a4",
          "size": 207
        },
        {
          "index": 6,
          "sha256": "1ce822b766afab63127e41d15d097b241ad5fa05937380e36cb82114570ad620",
          "size": 174
        },
        {
          "index": 7,
          "sha256": "2ac2242f18df53d383d8dc59d2e954c48e12621ff45603d10f7bf7f5d0700408",
          "size": 3335
        },
        {
          "index": 8,
          "sha256": "3f147e0f862cfdb6285494abfdec44030dbbc1d807f92d439f1d1f4f7d093407",
          "size": 68
        },
        {
          "index": 9,
          "sha256": "638c9849120a0ca3fdc532759b2a273b5eda44f1b37fd1addb3738663107154f",
          "size": 132
        },
        {
          "index": 10,
          "sha256": "b2d84a7977b82bc38996d585dc38f099bc23fc4570758c3b11aff962ae2b403b",
          "size": 195
        },
        {
          "index": 11,
          "sha256": "3e3566f8d3b17ca652da0f4b56eb75bcb278e324daa2b8de23530f574219d91c",
          "size": 187
        },
        {
          "index": 12,
          "sha256": "4fc0635e75192abf47d7e3a737ba71d62728b733b171001d08e438e7e5a234ac",
          "size": 150
        },
        {
          "index": 13,
          "sha256": "5f6beb84ea4571a68a633d0b24929337cb2c3bba905898987f2c0c4180608b14",
          "size": 71
        },
        {
          "index": 14,
          "sha256": "4ce1ea8c08b54f620a92d02b63046a789d84cad63aea5820c315f6f80e3807ab",
          "size": 76
        },
        {
          "index": 15,
          "sha256": "44f87da3aa923818646f3bc2c95e5a1eb180eb19e883ce38836222596ff42004",
          "size": 113
        },
        {
          "index": 16,
          "sha256": "1c97c6441042ca49d7e516bde20c0924f10fd292961ee9dd946c87caaac975c1",
          "size": 118
        },
        {
          "index": 17,
          "sha256": "870e67e8c16b7dfe92add091701f6e51817525e59d59843895c2791853a9c060",
          "size": 71
        },
        {
          "index": 18,
          "sha256": "8f22b584a1107e672fff93baacecddb0eda0c2772bfe3ebe1707461f650b5352",
          "size": 76
        },
        {
          "index": 19,
          "sha256": "e8eac974bc357708b9c6675d42d3f937042cd8643c2f6a1400771ddf3939b543",
          "size": 92
        },
        {
          "index": 20,
          "sha256": "92a4c93a316a65399357e5693197c0e733cf9f86500e5470b0a9d2fbc6e6f56b",
          "size": 116
        },
        {
          "index": 21,
          "sha256": "d9f1f2d78269d9fede687216c8a3ef065f3bd3a0e6227fc6f5417d90a44e091f",
          "size": 181
        },
        {
          "index": 22,
          "sha256": "99054889f9cd7fc8aa03fdf68fe502e31fc9047eeb42b05738b2ca0e5c57e83a",
          "size": 64
        },
        {
          "index": 23,
          "sha256": "baf69f8148174b1c387672645173de78a92bcb8e54487cb9a3ad5826f8723b1c",
          "size": 133
        },
        {
          "index": 24,
          "sha256": "15c9f555bfb03d14a006861812e51f3ca190b8f36057b59e879a6f79e00c384b",
          "size": 832
        },
        {
          "index": 25,
          "sha256": "bb3dbab1cb669b5ce554cab37cd9423ec1936572cd5a9f0a81dfb0b5e3c57c63",
          "size": 1831
        },
        {
          "index": 26,
          "sha256": "e8ca6b96caf6fcf0283d4096b7adec198f5822761a2e0a1ff4229861209475a2",
          "size": 73
        },
        {
          "index": 27,
          "sha256": "3dfc012606b3172f2572f8be43da33383220ddd7678da9affe2d7f2aea735645",
          "size": 112
        },
        {
          "index": 28,
          "sha256": "0326eb3ee4bca91ea5ba71691dd1566a4ed644959c0684009d90915c01e3e617",
          "size": 1534
        },
        {
          "index": 29,
          "sha256": "0a806a40c1c48e4632d49318c867bd27e733e959216f33e61898e06178554f94",
          "size": 74
        },
        {
          "index": 30,
          "sha256": "650afc03818fc790ee6479433cae04c01e0f17b3ade76af76e10b416bd27c18f",
          "size": 113
        },
        {
          "index": 31,
          "sha256": "9971893d5634ecdbb3003f52ab077d85935f47c2075deb545e8f5894aff30959",
          "size": 190
        },
        {
          "index": 32,
          "sha256": "00a35f4a5f996746efc56f4347bc253e1450bce335c91c2f98e99e05391d17e3",
          "size": 2598
        },
        {
          "index": 33,
          "sha256": "db899a5ec4cb8586f7216eff1970d94a89560fe4a8a80a55345247dcbb5143d1",
          "size": 73
        },
        {
          "index": 34,
          "sha256": "06993dddbc025661ce4c53f54f42bc469f5d718c399cf8d06b32b51e1c28b4ab",
          "size": 112
        },
        {
          "index": 35,
          "sha256": "cabd3e79ab40ed7c3f781a76ec6c66a6fdde9e5275aaa89684c6189c4b477f1b",
          "size": 184
        },
        {
          "index": 36,
          "sha256": "f3365fe91d784a622ea6422b0dd1cfa20f7d14ac6f1695b5a6bac71d0d6d4430",
          "size": 3088
        },
        {
          "index": 37,
          "sha256": "4ed86535b2516e0ca67469c53e43ae3bf86af65f3dd97d6b87fbe69745429d26",
          "size": 79
        },
        {
          "index": 38,
          "sha256": "ecedb3baaba86d509747b81fe9f83f6f467853de36b6a93729e6d20e89cec40e",
          "size": 118
        },
        {
          "index": 39,
          "sha256": "1fd37338ab31c7f4728785cc03d1e6c71ff4a5545b421bee0f52717160faacf2",
          "size": 199
        },
        {
          "index": 40,
          "sha256": "4ada7a11555007fb0e6fbbc6b07c0e4b5bccf179b78f0c8f2bdbaee44ef23a44",
          "size": 662
        },
        {
          "index": 41,
          "sha256": "ff29bbb862d67b7914b34fbfb3ed4c241fcfff8bd0592024593f3d943c8c381b",
          "size": 8186
        },
        {
          "index": 42,
          "sha256": "9e3253548e13b28f46761007c937a4f1967e0c725d69007c6765cb2b1ecb8888",
          "size": 2661
        },
        {
          "index": 43,
          "sha256": "5fe1482c04912a926c101a95409390fdc02b5a4a04c8b5d59c4835ea851b4a02",
          "size": 10951
        },
        {
          "index": 44,
          "sha256": "b961d5e3fd0a5b81698ee43841ccc901ae3fa8addb3ab127aefa0526a3d5558d",
          "size": 38919
        },
        {
          "index": 45,
          "sha256": "231102e7275b0c935b39d9d3c95e17a26caf81e25b6336908eed9c831097ff7b",
          "size": 103
        },
        {
          "index": 46,
          "sha256": "22e1b069d0b8b7e67ac5cf5f4e19509c69310132bca1aa8f325ae2712d9ebb3d",
          "size": 140
        },
        {
          "index": 47,
          "sha256": "8f9de8bd34a7cf23fb1cfe3531159a041424ff3a211fc48a76410922aad7e0cd",
          "size": 112
        },
        {
          "index": 48,
          "sha256": "a224992d88b32dc63bd995406a4345907473a3f507fcbeae80db2b3cb8075a5d",
          "size": 340
        },
        {
          "index": 49,
          "sha256": "115d7267a93edd18b3a77cca87278cf0dbc9815ae18997a7a8995ee43bf102b6",
          "size": 90
        },
        {
          "index": 50,
          "sha256": "9fd37d81ce9bc5c3fc3a7d8cedeba9f7a467ff79d84ee48b87c5d46cb3728b24",
          "size": 127
        },
        {
          "index": 51,
          "sha256": "912c8e446f63fbb3d9cd36ac86485845fc6481496c5139b667756e78c95cc3bf",
          "size": 99
        },
        {
          "index": 52,
          "sha256": "b0df014bc0ad177317582b43a0f603ae95c2db1178e5e734d22a54938b47ac9e",
          "size": 25443
        },
        {
          "index": 53,
          "sha256": "62a405fc9aa6196bc821f7a551f0148ce6df5c509694b3eb21251d38e2d6608d",
          "size": 97
        },
        {
          "index": 54,
          "sha256": "0f2c4b365c8ace21f05d4f1c775b59a9b859cc5b6a786b3a39b7ebe75bc9f71c",
          "size": 134
        },
        {
          "index": 55,
          "sha256": "fd00b3660325073f4172bff9288771760d19c5eaea625fb0eff73cbc93348716",
          "size": 106
        },
        {
          "index": 56,
          "sha256": "3042aac9086a06602e19b2873762690e54bf49428026caf438823f27b7a0ba54",
          "size": 20725
        },
        {
          "index": 57,
          "sha256": "b49ee7657e6fd91418a2de70ceb377f4f5649821167476ac4e74f5afb53efb92",
          "size": 120
        },
        {
          "index": 58,
          "sha256": "626644cdf4089a00d66a4d1f3e45c4d1064a92806e13e2ffd5ab2681212bc523",
          "size": 157
        },
        {
          "index": 59,